volume_index,volume_title,source,paragraph_id,duplicate_broad_categories,duplicate_specific_subjects,text
34,卷十七·广动植之二,三校,V34-P837,人物政事、植物、建筑寺塔、器物技艺、饮食医药,帝王、花草、宫殿城楼、衣饰、医术药理,《博雅》：「在屋曰昔耶，在墙曰垣衣。」《广志》谓之兰香，生于久屋之瓦。魏明帝好之，命长安西载其瓦于洛阳，以覆屋。前代词人诗中多用昔耶，梁简文帝《咏蔷薇》曰：「缘……
34,卷十七·广动植之二,三校,V34-P843,人物政事、植物、建筑寺塔、器物技艺、佛道宗教、饮食医药、梦兆占卜、天文地理、超自然力量,将相臣子、花草、寺观塔庙、用具杂器、佛法、食物饮品、医术药理、占卜预言、祥瑞灾异、天象、地理山水、灵异物件,牡丹，前史中无说处，唯《谢康乐集》中言竹间水际多牡丹。成式捡隋朝《种植法》七十卷中，初不记说牡丹，则知隋朝花药中所无也。开元末，裴士淹为郎官，奉使幽冀回，至汾州……
34,卷十七·广动植之二,三校,V34-P844,植物、建筑寺塔、佛道宗教、饮食医药,花草、寺观塔庙、道法、食物饮品,兴唐寺有牡丹窠，元和中着花千二百朵。其色有正晕、倒晕、浅红、浅紫、深紫、黄白檀等，独无深红。又有花叶中无抹心者。重台花者，其花面径七八寸。兴善寺素师院牡丹，色绝……
34,卷十七·广动植之二,三校,V34-P846,植物、建筑寺塔、佛道宗教、饮食医药、梦兆占卜、天文地理,花草、寺观塔庙、佛法、医术药理、祥瑞灾异、地理山水,茄子，茄字本莲茎名，革遐反。今呼伽，未知所自。成式因就节下食有伽子数蒂，偶问工部员外郎张周封伽子故事，张云：「名落苏，事具《食疗本草》。此误作《食疗本草》，元出……
34,卷十七·广动植之二,三校,V34-P847,植物、建筑寺塔、器物技艺、佛道宗教、天文地理、超自然力量,树木、宫殿城楼、用具杂器、衣饰、佛法、天象、灵异物件,异菌，开城元年春，成式修竹里私第书斋前，有枯紫荆数枝蠹折，因伐之，余尺许。至三年秋，枯根上生菌，大如斗。下布五足，顶黄白两晕，绿垂裙如鹅鞴，高尺余。至午，色变黑……
34,卷十七·广动植之二,三校,V34-P852,植物、天文地理,花草、地理山水,睡莲，南海有睡莲，夜则花低入水。屯田韦郎中从事南海，亲见。
34,卷十七·广动植之二,三校,V34-P866,植物、异域物产,果蔬、异国,蔓胡桃，出南诏。大如扁螺，两隔，味如胡桃。或言蛮中藤子也。
34,卷十七·广动植之二,三校,V34-P882,动物、鬼怪妖魅,鸟类、仙神,乌蓬，叶如鸟翅，俗呼为仙人花。
34,卷十七·广动植之二,三校,V34-P890,动物、天文地理,鸟类、地理山水,地日草，南方有地日草。三足鸟欲下食此草，羲和之驭，以手掩乌目，食此则美闷不复动。东方朔言，为小儿时，井陷，坠至地下，数十年无所寄托。有人引之，令往此草中，隔红泉……
35,卷二十·肉攫部,三校,V35-P893,动物、天文地理,鸟类、天象,取鹰法，七月二十日为上时，内地者多，塞外者殊少。八月上旬为次时。八月下旬为下时，塞外鹰毕至矣。鹰网目方寸八分，从八十目，横五十目，以黄蘖和杼汁染之，令与地色相类……
35,卷二十·肉攫部,三校,V35-P898,动物、天文地理,鸟类、天象,雕角鹰等，三月一日停放，四月上旬置笼。
35,卷二十·肉攫部,三校,V35-P903,动物、器物技艺、天文地理,鸟类、衣饰、天象,齐王高纬武平六年，得幽州行台仆射河东潘子光所送白鸽，合身如雪色。视臆前微微有纵白斑之理，理色暧昧如纁。觜本之色微带青白，向末渐乌。其爪亦同于觜。蜡胫并作黄白赤。……
35,卷二十·肉攫部,三校,V35-P906,人物政事、动物,帝王、鸟类,又高帝武平初，领军将军赵野叉献白免鹰一联，头及顶遥看悉白，近边熟视，乃有紫迹在毛心。其背上以白地紫迹点其毛心，紫外有白赤周绕，白色之外以黑为缘。翅毛亦以白为地，……
35,卷二十·肉攫部,三校,V35-P922,植物、天文地理,树木、地理山水,黑皂鹂，大者五斤，生渔阳山松杉树上，多死。时有快者，章武飞。白皂鹂，大者五斤，生渔阳、白道、河阳、漠北，所在皆有。生柏枯树上，便鸟，向灵丘、中山、范阳、章武飞。……
36,续·支诺皋上,三校,X36-P928,动物、器物技艺、饮食医药、天文地理,兽类、衣饰、食物饮品、医术药理、天象,新罗国有第贵族金哥。其远祖名旁，有弟人，甚有家财。其兄旁因分居，乞衣食，国人有与其隙地亩，乃求蚕穀种于弟，弟蒸而与之，不知也。至蚕时，有蚕生焉，目长寸余，居旬大……
36,续·支诺皋上,三校,X36-P929,建筑寺塔、器物技艺、佛道宗教,寺观塔庙、用具杂器、佛法,临濑西北有寺，寺僧智通，常持《法华经》入禅。每晏坐，必求寒林静境，殆非人所至。经数年，忽夜有人环其院呼智通，至晓声方息。历三夜，声侵户，智通不耐，应曰：「汝呼我……
36,续·支诺皋上,三校,X36-P930,器物技艺、丧葬冥界、梦兆占卜、天文地理、超自然力量,用具杂器、衣饰、丧葬、占卜预言、地理山水、灵异物件,南人相传，秦汉前有洞主吴氏，土人呼为吴洞。娶两妻，妻卒。有女名叶限，少惠，善陶金，父爱之。末岁父卒，为后母所苦，常令樵险汲深。时尝得鳞，二寸余，赬鬐金目，遂潜养……
36,续·支诺皋上,三校,X36-P931,建筑寺塔、饮食医药,宫殿城楼、医术药理,太和五年，复州医人王超，善用针，病无不差。于午忽无病死，经宿而苏。言始梦至处，城壁台殿如王者居。见人卧，召前袒视，左髆有肿，大如杯。令超治之，即为针出脓升余。顾……
36,续·支诺皋上,三校,X36-P932,饮食医药、梦兆占卜、天文地理,医术药理、占卜预言、天象,前秀才李鹄觐于颍川，夜至一驿，才卧，见物如猪者突上厅阶。鹄惊走，透后门，投驿厩，潜身草积中，屏息且伺之。怪亦随至，声绕草积数匝，瞪目相视鹄所潜处，忽变为巨星，腾……
36,续·支诺皋上,三校,X36-P934,动物、佛道宗教,昆虫、佛法,贞元中，蜀郡有僧志功，言住宝相寺持经。夜久，忽有飞虫五六枚，大如蝇，金色，迭飞起灯焰。或蹲于炷花上鼓翅，与火色，久乃灭焰中。如此数夕。童子击堕枚，乃薰陆香也，亦……
36,续·支诺皋上,三校,X36-P935,动物、建筑寺塔、器物技艺、饮食医药、梦兆占卜,兽类、宫殿城楼、用具杂器、衣饰、食物饮品、占卜预言,元和初，上都东市恶少李和子，父努眼。和子性忍，常攘狗及猫食之，为坊市之患。常臂鹞立于衢，见二人紫衣，呼曰：「公非李努眼子名和子乎？」和子即遽只揖。又曰：「有故，……
36,续·支诺皋上,三校,X36-P936,植物、饮食医药,树木、医术药理,贞元末，开州军将冉从长轻财好事，而州之儒生道者多依之。有画人宁采图为《竹林会》，甚工。坐客郭萱、柳成二秀才，每以气相轧。柳忽眄图谓主人曰：「此画巧于体势，失于意……
36,续·支诺皋上,三校,X36-P938,器物技艺、梦兆占卜,衣饰、梦兆,柳璟知举年，有国子监明经，失姓名，昼寝，梦徙倚于监门。有一人负衣囊，衣黄，访明经姓氏。明经语之，其人笑曰：「君来春及第。」明经因访邻房乡曲五六人，或言得者，明经……
36,续·支诺皋上,三校,X36-P939,建筑寺塔、梦兆占卜、天文地理,宫殿城楼、占卜预言、天象、地理山水,潞州军校郭谊，先为邯郸郡牧使，因兄亡，遂于郓州举其先，同茔葬于磁州滏阳县之西岗。县界接山，土中多石，有力葬者，率皆凿石为穴。谊之所卜亦凿焉。积日倍工，忽透一穴。……
36,续·支诺皋上,三校,X36-P940,器物技艺、佛道宗教、天文地理,用具杂器、佛法、天象,伊阙县令李师晦，有兄弟任江南官，与僧往还。常入采药，遇暴风雨，避于欹树。须臾大震，有物瞥然坠地。倏而朗睛，僧就视，乃石，形如乐器，可以悬击者。其上平齐如削，其中……
36,续·支诺皋上,三校,X36-P943,人物政事、动物、器物技艺、丧葬冥界、饮食医药、天文地理,道士方士、兽类、用具杂器、衣饰、冥界、食物饮品、医术药理、天象,醴泉尉崔汾仲兄居长安崇贤里。夏月乘凉于庭际，疏旷月色，方午风过，觉有异香。顷间，闻南垣土动簌簌，崔生意其蛇鼠也。忽睹道士，大言曰：「大好月色。」崔惊惧遽走。道士……
36,续·支诺皋上,三校,X36-P944,器物技艺、佛道宗教、饮食医药、梦兆占卜、天文地理、超自然力量,衣饰、佛法、食物饮品、祥瑞灾异、天象、灵异物件,辛秘五经擢第后，常州赴婚。行至陕，因息于树阴。傍有乞儿箕坐，痂面虮衣，访辛行止，辛不耐而去，乞儿亦随之。辛马劣，不能相远，乞儿强言不已。前及衣绿者，辛揖而与之语……
37,续·支诺皋中,三校,X37-P945,人物政事、建筑寺塔,将相臣子、宫殿城楼,上都浑宅，戟门内小槐树，树有穴，大如钱。每夜月霁后，有蚓如巨臂，长二尺余，白颈红斑，领数百条如索，缘树枝条。及晓，悉入穴。或时众鸣，往往成曲。学士张乘言，浑令公……
37,续·支诺皋中,三校,X37-P946,植物、建筑寺塔,花草、宫殿城楼,东都尊贤坊田令宅，中门内有紫牡丹成树，发花千朵。花盛时，每月夜有小人五六，长尺余，游于上。如此七八年。人将掩之，辄失所在。
37,续·支诺皋中,三校,X37-P947,人物政事、动物、佛道宗教、天文地理,帝王、兽类、佛法、天象,太和七年，上都青龙寺僧契宗，俗家在樊州。其兄樊竟，因病热，乃狂言虚笑。契宗精神总持，遂焚香敕勒。兄忽诟骂曰：「汝是僧，第归寺住持，何横于事？我止居在南柯，爱汝苗……
37,续·支诺皋中,三校,X37-P948,建筑寺塔、饮食医药、梦兆占卜、天文地理,宫殿城楼、食物饮品、祥瑞灾异、天象、地理山水,贞元中，望苑驿西有百姓王申，手植榆于路傍成林，构茅屋数椽，夏月常馈浆水于行人，官者即延憩具茗。有儿年十三，每令伺客。忽一日，白其父：「路有女子求水。」因令呼入。……
37,续·支诺皋中,三校,X37-P952,佛道宗教、饮食医药,佛法、医术药理,元和中，光宅坊百姓失名氏，其家有病者将困，迎僧持念，妻儿环守之。夕，众仿佛见人入户，众遂惊逐，乃投于瓮间。其家以汤沃之，得一袋，盖鬼间所谓搐气袋也。忽听空中有声……
37,续·支诺皋中,三校,X37-P955,建筑寺塔、佛道宗教,宫殿城楼、道法,上都务本坊，贞元中有家，因打墙掘地，遇石函。发之，见物如丝满函，飞出于外。惊视之次，忽有一人起于函，被白发，长丈余，振衣而起，出门失所在。其家亦无他。前记之中多……
37,续·支诺皋中,三校,X37-P959,人物政事、动物、器物技艺、佛道宗教、饮食医药、天文地理,帝王、将相臣子、兽类、用具杂器、衣饰、佛法、食物饮品、医术药理、天象,姚司马者，寄居汾州，宅枕溪。有二小女常戏钓溪中，未常有获。忽挠竿各得物，若鱣者而毛，若鳖者而鳃。其家异之，养以盆池。经年，二女精神恍惚，夜常明灯锉针，染蓝涅皂，……
37,续·支诺皋中,三校,X37-P960,植物、器物技艺、佛道宗教、梦兆占卜、天文地理、超自然力量,树木、花草、用具杂器、衣饰、佛法、占卜预言、祥瑞灾异、天象、灵异物件,东都龙门有处，相传广成子所居也。天宝中，北宗雅禅师者，于此处建兰若。庭中多古桐，枝干拂地。年中，桐始华，有异蜂，声如人吟咏。禅师谛视之，具体人也，但有翅长寸余。……
37,续·支诺皋中,三校,X37-P962,建筑寺塔、佛道宗教,宫殿城楼、佛法,上都僧太琼者，能讲《仁王经》。开元初，讲于奉化县京遥村，遂止村寺。经两夏，于日，持钵将上堂，阖门之次，有物坠檐前。时天才辨色，僧就视之，乃初生儿，其襁裼甚新。僧……
37,续·支诺皋中,三校,X37-P963,植物、建筑寺塔、器物技艺、佛道宗教、梦兆占卜、天文地理、超自然力量,药草、宫殿城楼、衣饰、佛法、祥瑞灾异、天象、地理山水、灵异物件,陕州西北白径岭上逻村村人田氏，常穿井得根，大如臂，节中粗，皮若茯苓，气似术。其家奉释，有像设数十，遂置于像前。田氏名登娘，年十六七，有容质，父常令供香火焉。经岁……
37,续·支诺皋中,三校,X37-P967,动物、建筑寺塔、饮食医药、梦兆占卜、天文地理、超自然力量,兽类、宫殿城楼、食物饮品、祥瑞灾异、地理山水、灵异物件,虢州五城县黑鱼谷，贞元中，百姓王用业炭于谷中。中有水，方数步，常见二黑鱼，长尺余，游于水上。用伐木饥困，遂食鱼。其弟惊曰：「此鱼或谷中灵物，兄奈何杀此！」有顷，……
37,续·支诺皋中,三校,X37-P968,人物政事、建筑寺塔、天文地理,将相臣子、宫殿城楼、天象,元和初，上都义宁坊有妇人风狂，俗呼为五娘，常止宿于永穆墙垣下。时中使茹大夫使于金陵，有狂者，众名之信夫，或歌或哭，往往验未来事，盛暑拥絮未常沾汗，冱寒袒露体无拘……
37,续·支诺皋中,三校,X37-P970,鬼怪妖魅、佛道宗教、饮食医药、梦兆占卜,仙神、道法、医术药理、占卜预言,建中末，书生何讽常买得黄纸古书一卷。读之，卷中得发卷，规四寸，如环无端，何因绝之。断处两头滴水升余，烧之作发气。讽尝言于道者，吁曰：「君固俗骨，遇此不能羽化，命……
37,续·支诺皋中,三校,X37-P971,梦兆占卜、天文地理,祥瑞灾异、地理山水,华阴县东七级赵村，村路因水啮成谷，梁之。村人日行车过桥，桥根坏，坠车焉，村人不复收。积三年，村正尝夜度桥，见群小儿聚火为戏。村正知其魅，射之，若中木声。火即灭，……
37,续·支诺皋中,三校,X37-P972,建筑寺塔、器物技艺、饮食医药,宫殿城楼、用具杂器、食物饮品,相国李公固言，元和六年下第游蜀，遇老姥，言：「郎君明年芙蓉镜下及第，后二纪拜相，当镇蜀土。某此时不复见郎君出将之荣也。」明年，果然状头及第，诗赋题有「人镜芙蓉」……
38,续·支诺皋下,三校,X38-P977,饮食医药、梦兆占卜,医术药理、占卜预言,开元末，蔡州上蔡县南李村百姓李简痫疾卒。瘗后十余日，有汝阳县百姓张弘义素不与李简相识，所居相去十余舍，亦因病死，经宿却活，不复认父母妻子，且言：「我是李简，家住……
38,续·支诺皋下,三校,X38-P978,人物政事、佛道宗教,僧尼、佛法,武宗六年，扬州海陵县还俗僧义本且死，托其弟言：「我死，必为我剃须发，衣僧衣三事。」弟如其言。义本经宿却活，言见二黄衣吏追至冥司，有若王者问曰：「此何州县？「吏言……
38,续·支诺皋下,三校,X38-P979,饮食医药、天文地理,医术药理、天象,汴州百姓赵怀正，住光德坊。太和三年，妻阿贺常以女工致利。日，有人携石枕求售，贺环获焉。赵夜枕之，觉枕中如风雨声。因令妻子各枕夕，无所觉。赵枕辄复如旧，或喧悸不得……
38,续·支诺皋下,三校,X38-P980,鬼怪妖魅、器物技艺、佛道宗教、饮食医药、梦兆占卜、天文地理、超自然力量,鬼、衣饰、道法、医术药理、祥瑞灾异、天象、地理山水、法术仙术、灵异物件,成式三从房叔父某者，贞元末，自信安至洛，暮达瓜洲，宿于舟中。夜久，弹琴，觉舟外有嗟叹声，止息即无。如此数四，乃缓轸还寝。梦女子，年二十余，形悴衣败，前拜曰：「妾……
38,续·支诺皋下,三校,X38-P983,动物、佛道宗教,鱼类、佛法,越州有卢冉者，时举秀才，家贫，未及入京，因之顾头堰，堰在山阴县顾头村，与表兄韩确同居。自幼嗜鲙，在堰尝凭吏求鱼。韩方寝，梦身为鱼在潭，有相忘之乐。见二渔人乘艇张……
38,续·支诺皋下,三校,X38-P986,动物、建筑寺塔,鸟类、兽类、宫殿城楼,李正己本名怀玉，侯希逸之内弟也。侯镇淄青，署怀玉为兵马使。寻构飞语，侯怒，囚之，将置于法。怀玉抱冤无诉，于狱中累石象佛，默期冥报。时近腊日，心慕同侪，叹吒而睡。……
38,续·支诺皋下,三校,X38-P987,饮食医药、天文地理,医术药理、天象、地理山水,河南少尹韦绚，少时，常于夔州江岸见异虫。初疑棘针枝，从者惊曰：「此虫有灵，不可犯之。或致风雷。」韦试令踏地惊之，虫伏地如灭，细视地上若石脉焉。良久，渐起如旧。每……
38,续·支诺皋下,三校,X38-P988,建筑寺塔、佛道宗教、饮食医药、梦兆占卜、天文地理,宫殿城楼、佛法、医术药理、占卜预言、地理山水,永宁王相王涯三怪：淅米匠人苏润，本是王家炊人，至荆州方知，因问王家咎徵，言宅南有井，每夜常沸涌有声，昼窥之，或见铜厮罗，或见银熨斗者，水腐不可饮。又王相内斋有禅……
38,续·支诺皋下,三校,X38-P991,植物、鬼怪妖魅、建筑寺塔、器物技艺、佛道宗教、饮食医药、梦兆占卜、天文地理、超自然力量,花草、仙神、宫殿城楼、用具杂器、衣饰、佛法、食物饮品、占卜预言、天象、法术仙术,成都坊正张和。蜀郡有豪家子，富拟卓、郑，蜀之名姝，无不毕致。每按图求丽，媒盈其门，常恨无可意者。或言：「坊正张和，大侠也。幽房闺稚，无不知之，盍以诚投乎？」豪家……
38,续·支诺皋下,三校,X38-P993,动物、建筑寺塔、饮食医药、梦兆占卜、天文地理,鸟类、宫殿城楼、医术药理、占卜预言、天象、地理山水,忠州垫江县县吏冉端，开成初，父死。有严师者，善山冈，为卜地，云合有生气群聚之物。掘深丈余，遇蚁城，方数丈，外重雉堞皆具，子城谯橹工若雕刻。城内分径街，小垤相次。……
38,续·支诺皋下,三校,X38-P994,人物政事、动物、天文地理,道士方士、爬行两栖、地理山水,朱道士者，太和八年，常游庐山，憩于涧石。忽见蟠蛇，如堆缯锦，俄变为巨龟。访之山叟，云是玄武。
38,续·支诺皋下,三校,X38-P995,人物政事、佛道宗教、天文地理,道士方士、道法、天象,朱道士又曾游青城山丈人观，至龙桥，见岩下有枯骨，背石平坐，按手膝上，状如钩锁，附苔络蔓，色白如雪。云祖父已尝见，不知年代，其或炼形濯魄之士乎？
38,续·支诺皋下,三校,X38-P996,人物政事、建筑寺塔、天文地理,帝王、将相臣子、宫殿城楼、天象、地理山水,武宗之元年，戎州水涨，浮木塞江。刺史赵士宗召水军接水，约获百余段。公署卑小，地窄不复用，因并修开元寺。后月余日，有夷人逢人如猴，着故青衣，亦不辩何制，云：「关将……
38,续·支诺皋下,三校,X38-P997,建筑寺塔、器物技艺,寺观塔庙、衣饰,成都乞儿严七师，幽陋凡贱，涂垢臭秽不可近。言语无度，往往应于未兆。居西市悲田坊，常有帖衙俳儿干满川、白迦、叶珪、张美、张翱等五人为火。七师遇于途，各与十五文，勤……
38,续·支诺皋下,三校,X38-P998,鬼怪妖魅、佛道宗教、丧葬冥界、饮食医药、天文地理,鬼、道法、丧葬、医术药理、天象、地理山水,荆州百姓郝惟谅，性粗率，勇于私斗。武宗会昌二年，寒食日，与其徒游于郊外，蹴鞠角力，因醉于墦间。迨宵分方始寤，将归，历道左里余，值人家，室绝卑，虽张灯而颇昏暗，遂……
38,续·支诺皋下,三校,X38-P999,人物政事、动物、佛道宗教、饮食医药、天文地理,道士方士、兽类、佛法、食物饮品、地理山水,衡岳西原近朱陵洞，其处绝险，多大木、猛兽，人到者率迷路，或遇巨蛇，不得进。长庆中，有头陀悟空，常裹粮持锡，夜入山林，越兕侵虎，初无所惧。至朱陵原，游览累日，扪萝……
38,续·支诺皋下,三校,X38-P1000,器物技艺、天文地理,用具杂器、地理山水,严绶镇太原，市中小儿如水际泅戏。忽见物中流流下，小儿争接，乃一瓦瓶，重帛幕之。儿就岸破之，有婴儿，长尺余，遂走。群儿逐之，顷间足下旋风起，婴儿已蹈空数尺。近岸，……
38,续·支诺皋下,三校,X38-P1002,佛道宗教、饮食医药,佛法、医术药理,世有村人供于僧者，祈其密言，僧绐之曰：「驴」。其人遂日夕念之。经数岁，照水，见青毛驴附于背。凡有疾病魅鬼，其人至其所立愈。后知其诈，咒效亦歇。
38,续·支诺皋下,三校,X38-P1004,人物政事、建筑寺塔、器物技艺、天文地理,将相臣子、宫殿城楼、用具杂器、衣饰、天象,韦斌虽生于贵门，而性颇厚质，然其地望素高，冠冕特盛。虽门风稍奢，而斌立朝侃侃，容止尊严，有大臣之体。每会朝，未常与同列笑语。旧制，群臣立于殿庭，既而遇雨雪，亦不……
38,续·支诺皋下,三校,X38-P1005,植物、建筑寺塔、饮食医药、梦兆占卜、天文地理、超自然力量,花草、果蔬、药草、宫殿城楼、医术药理、占卜预言、天象、灵异物件,天宝中，处士崔玄微洛东有宅，耽道，饵术及茯苓三十载。因药尽，领童仆辈入嵩山采芝，年方回，宅中无人，蒿莱满院。时春季夜间，风清月朗，不睡，独处院，家人无故辄不到。……
39,续·贬误,三校,X39-P1007,动物、天文地理,鸟类、地理山水,予太和初从事浙西赞皇公幕中，尝因与曲宴，中夜，公语及国朝词人优劣，云：「世人言灵芝无根，醴泉无源，张曲江著词也。盖取虞翻《与弟求婚书》，徒以‘芝草’为‘灵芝’耳……
39,续·贬误,三校,X39-P1008,饮食医药、天文地理,医术药理、天象,范传正中丞举进士，省试《风过竹赋》，甚丽，为词人所讽。然为从竹之「箫」非萧艾之「萧」也。《荀子》云：「如风过萧，忽然已化。」义同「草上之风必偃」，相传至今已为误……
39,续·贬误,三校,X39-P1009,器物技艺、佛道宗教、天文地理,用具杂器、佛法、天象,相传云，释道钦住径山，有问道者，率尔而对，皆造宗极。刘忠州晏，尝乞心偈。令执炉而听，再三称「诸恶莫作，众善奉行」。晏曰：「此三尺童子皆知之。」钦曰：「三尺童子皆……
39,续·贬误,三校,X39-P1010,饮食医药、梦兆占卜、天文地理,医术药理、占卜预言、天象,相传云，韩晋公滉在润州，夜与从事登万岁楼。方酣，置杯不说，语左右曰：「汝听妇人哭乎？当近何所？」对：「在某街。「诘朝，命吏捕哭者讯之，信宿狱不具。吏惧罪，守于尸……
39,续·贬误,三校,X39-P1011,人物政事、饮食医药,帝王、食物饮品,相传云，德宗幸东宫，太子亲割羊脾，水泽手，因以饼洁之。太子觉上色动，乃徐卷而食。司空赞皇公著《次柳氏旧闻》又云是肃宗。刘餗《传记》云：「太宗使宇文士及割肉，以饼……
39,续·贬误,三校,X39-P1016,建筑寺塔、饮食医药、天文地理,宫殿城楼、食物饮品、天象,予在秘丘，尝见同官说，俗说楼罗，因天宝中进士有东西棚，各有声势，稍伧者多会于酒楼食毕罗，故有此语。予读梁元帝《风人辞》云：「城头网雀，楼罗人着。」则知楼罗之言，……
39,续·贬误,三校,X39-P1017,动物、天文地理,鸟类、地理山水,世说曹著轻薄才，长于题目人。常目一达官为热上猢狲，其实旧语也。《朝野佥载》云：「魏光乘好题目人。姚元之长大行急，谓之趁蛇鹳鹊。侍御史王旭短而黑丑，谓之烟薰水蛇。……
39,续·贬误,三校,X39-P1019,人物政事、饮食医药、天文地理,将相臣子、食物饮品、天象,俗好剧语者云，昔有某氏，破产贳酒，少有醒时。其友题其门阖云：「今日饮酒醉，明日饮酒醉。」邻人读之不解，曰：「今日饮酒醉，是何等语？」于今青衿之子，无不记者，《谈……
39,续·贬误,三校,X39-P1020,人物政事、饮食医药、天文地理,帝王、将相臣子、医术药理、地理山水,相传玄宗尝令左右提优人黄翻绰入池水中，复出，翻绰曰：「向见屈原笑臣：‘尔遭逢圣明，何尔至此？’「据《朝野佥载》，散乐高崔嵬善弄痴，大帝令没首水底，少顷，出而大笑……
