volume_index,volume_title,source,paragraph_id,duplicate_broad_categories,duplicate_specific_subjects,text
23,卷十·物异,三校,V23-P314,饮食医药、天文地理,食物饮品、地理山水,井，石阳县有井，水半青半黄。黄者如灰汁，取作粥饮，悉作金色，气甚芬馥。
23,卷十·物异,三校,V23-P328,植物、天文地理,花草、天象,甑花，滕景真在广州七层寺，元徽中，罢职归家，婢炊，釜中忽有声如雷，米上芃芃隆起。滕就视，声转壮，甑上花生数十，渐长似莲花，色赤，有光似金，俄顷萎灭。旬日，滕得病……
23,卷十·物异,三校,V23-P348,动物、梦兆占卜、天文地理、异域物产,兽类、祥瑞灾异、天象、地理山水、异国,铜马，俱德建国鸟浒河中滩派中有火祆祠，相传祆神本自波斯国乘神通来此，常见灵异，因立祆祠。内无象，于大屋下置大小炉，舍檐向西，人向东礼。有一铜马，大如次马，国人言……
23,卷十·物异,三校,V23-P350,佛道宗教、饮食医药,佛法、食物饮品,石鼍，私诃条国金辽山寺中有石鼍，众僧饮食将尽，向石鼍作礼，于是饮食悉具。
23,卷十·物异,三校,V23-P357,器物技艺、佛道宗教、天文地理,用具杂器、佛法、天象,壁影，高邮县有寺，不记名，讲堂西壁枕道。每日晚，人马车舆影悉透壁上，衣红紫者，影中卤莽可辨。壁厚数尺，难以理究。辰午之时则无。相传如此二十余年矣，或年半年不见。……
23,卷十·物异,三校,V23-P366,人物政事、鬼怪妖魅、梦兆占卜、天文地理、超自然力量,帝王、将相臣子、仙神、占卜预言、祥瑞灾异、天象、灵异物件,上清珠，肃宗为儿时，常为玄宗所器。每坐于前，熟视其貌，谓武惠妃曰：「此儿甚有异相，他日亦吾家有福天子。」因命取上清玉珠，以绛纱裹之，系于颈。是开元中罽宾国所贡，……
23,卷十·物异,三校,V23-P368,人物政事、天文地理、超自然力量,将相臣子、道士方士、地理山水、灵异物件,虞乡有山观，甚幽寂，有涤阳道士居焉。太和中，道士尝夕独登坛，望见庭內忽有异光，自井泉中发。俄有物，状若兔，其色若精金，随光而出，环绕醮坛。久之，复入于井。自是每……
24,卷十一·广知,三校,V24-P380,动物、植物、器物技艺、饮食医药、天文地理,鸟类、果蔬、衣饰、食物饮品、天象,《隐诀》言，太清外术：生人发挂果树，乌鸟不敢食其实。瓜两鼻两蒂，食之杀人。檐下滴菜有毒堇，黄花及赤芥，杀人。瓠牛践苗则子苦。大醉不可卧黍穰上，汗出眉发落。妇人有……
24,卷十一·广知,三校,V24-P381,动物、植物、饮食医药、天文地理,龙蛇类、鸟类、兽类、树木、花草、果蔬、食物饮品、医术药理、天象、地理山水,二目不同，连鳞白鬐，腹下丹字，并杀人。鳖目白，腹下五字、卜字者不可食。蟹腹下有毛，杀人。蛇以桑柴烧之，则见足出。兽歧尾，鹿斑如豹，羊心有窍，悉害人。马夜眼，五月……
24,卷十一·广知,三校,V24-P383,动物、器物技艺、天文地理、异域物产,鸟类、兽类、乐器、天象、异国,百体中有悬针书、垂露书、秦王破冢书、金鹊书、虎爪书、倒薤书、偃波书、信幡书、飞帛书、籀书、谬、篆书、制书、列书、日书、月书、风书、署书、虫食叶书、胡书、蓬书、天……
24,卷十一·广知,三校,V24-P386,器物技艺、超自然力量,用具杂器、灵异物件,"胡综、博物，孙权时掘得铜匣，长二尺七寸，以琉璃为盖。又一白玉如意，所执处皆刻龙虎及蝉形，莫能识其由。使人问综，综曰：""昔秦皇以金陵有天子气，平诸山阜，处处辄埋宝……"
24,卷十一·广知,三校,V24-P388,植物、饮食医药、梦兆占卜、天文地理、超自然力量,花草、食物饮品、祥瑞灾异、地理山水、灵异物件,历城北二里有莲子湖，周环二十里。湖中多莲花，红绿间明，乍疑濯锦。又渔船掩映，罟罾疏布，远望之者，若蛛网浮枉也。魏袁翻曾在湖醼集，参军张伯瑜谘公，言：「向为血羹，……
24,卷十一·广知,三校,V24-P391,梦兆占卜、天文地理,占卜预言、天象,相传识人星不患疟，成式亲识中，识者悉患疟。又俗不欲看天狱星，有流星人，当被发坐哭之，候星却出，灾方弭。《金楼子》言：「予以仰占辛苦，侵犯霜露，又恐流星入天牢。」……
24,卷十一·广知,三校,V24-P392,动物、佛道宗教,兽类、佛法,荆州陟屺寺僧那照善射，每言光长而摇者鹿，帖地而明灭者兔，低而不动者虎。又言，夜格虎时，必见三虎并来，挟者虎威，当刺其中者。虎死威乃入地，得之可却百邪。虎初死，记……
24,卷十一·广知,三校,V24-P394,人物政事、饮食医药,道士方士、食物饮品,道士郭采真言，人影数至九。成式常试之，至六七而已，外乱莫能辨，郭言渐益炬则可别。又说九影各有名，影神：一名右皇，二名魍魉，三名泄节枢，四名尺凫，五名索关，六名魄……
24,卷十一·广知,三校,V24-P395,饮食医药、梦兆占卜、天文地理,医术药理、占卜预言、地理山水,宝历中，有王山人，取人本命日，五更张灯相人影，知休咎。言人影欲深，深则贵而寿。影不欲照水、照井及浴盆中，古人避影亦为此。古蠼螋、短狐、踏影蛊，皆中人影为害。近有……
24,卷十一·广知,三校,V24-P396,动物、佛道宗教、天文地理,鸟类、佛法、天象,都下佛寺往往有神鸟雀不污者，凤翔山人张盈善飞化甲子，言或有佛寺金刚鸟不集者，非其灵验也，盖由取土处及塑像时，偶与日辰王相相符也。
24,卷十一·广知,三校,V24-P397,人物政事、动物、建筑寺塔、佛道宗教,僧尼、鸟类、寺观塔庙、佛法,又言，相寺观当阳像，可知其贫富。故洛阳修梵寺有金刚二，鸟雀不集。元魏时，梵僧菩提达摩称得其真像也。
24,卷十一·广知,三校,V24-P399,人物政事、鬼怪妖魅、佛道宗教、超自然力量,道士方士、鬼、道法、法术仙术,李洪山人，善符籙，博知，常谓成式：「瓷瓦器璺者可以弃，昔遇道，言雷蛊及鬼魅多遁其中。」
24,卷十一·广知,三校,V24-P402,佛道宗教、饮食医药,佛法、食物饮品、医术药理,慈恩寺僧广升言，贞元末，阆州僧灵鉴善弹。其弹丸方，用洞庭沙岸下，土三斤，炭末三两，瓷末两，榆皮半两，泔淀二勺，紫矿二两，细沙三分，藤纸五张，渴搨汁半合，九味和捣……
24,卷十一·广知,三校,V24-P403,人物政事、动物、梦兆占卜、天文地理,将相臣子、龙蛇类、祥瑞灾异、天象,王彦威尚书在汴州，二年，夏旱，时袁王传季玘寓汴，因宴王以旱为言，季醉曰：「欲雨甚易耳。可求蛇医四头，十石瓮二枚，每瓮实以水，浮二蛇医，以木盖密泥之，分置于闲处，……
25,卷十二·语资,三校,V25-P406,人物政事、动物、建筑寺塔、器物技艺、天文地理,将相臣子、鸟类、兽类、宫殿城楼、用具杂器、地理山水,梁遣黄门侍郎明少遐、秣陵令谢藻、信威长史王缵冲、宣城王文学萧恺、兼散骑常侍袁狎、兼通直散骑常侍贺文发宴魏使李骞、崔劼。温良毕，少遐咏骞赠其诗曰：「萧萧风帘举，依……
25,卷十二·语资,三校,V25-P408,器物技艺、饮食医药、梦兆占卜,用具杂器、食物饮品、占卜预言,梁宴魏使，魏肇师举酒劝陈昭曰：「此席已后，便与卿少时阻阔，念此甚以凄眷。」昭曰：「我钦仰名贤，亦何已也。路中都不尽深心，便复乖隔，泫叹如何！」俄而酒至鹦鹉杯，徐……
25,卷十二·语资,三校,V25-P409,人物政事、器物技艺、佛道宗教,侠盗刺客、衣饰、佛法,宁王常猎于鄠县界，搜林，忽见草中柜，扃锁甚固。王命发视之，乃少女也。问其所自，女言：「姓莫氏，叔伯庄居。昨夜遇光火贼，贼中二人是僧，因劫某至此。」动婉含颦，冶态……
25,卷十二·语资,三校,V25-P412,人物政事、天文地理,帝王、将相臣子、天象,黄儿，矮陋机惠，玄宗常凭之行。问外间事，动有锡赍。号曰肉杌。一日入迟，上怪之，对曰：「今日雨淖，向逢捕贼官与臣争道，臣掀之坠马。」因下阶叩头。上曰：「外无奏，汝……
25,卷十二·语资,三校,V25-P415,饮食医药、天文地理,食物饮品、天象,秦叔宝所乘马，号忽雷驳，常饮以酒。每于月明中试，能竖越三领黑毡。及胡公卒，嘶鸣不食而死。
25,卷十二·语资,三校,V25-P418,梦兆占卜、天文地理,占卜预言、天象、地理山水,魏仆射收临代，七月七日登舜山，徘徊顾眺，谓主簿崔曰：「吾所经多矣，至于山川沃壤，襟带形胜，天下名州，不能过此。唯未审东阳何如？」崔对曰：「青有古名，齐得旧号，二……
25,卷十二·语资,三校,V25-P423,人物政事、建筑寺塔、梦兆占卜、天文地理,帝王、宫殿城楼、占卜预言、祥瑞灾异、天象、地理山水,李白名播海内，玄宗于便殿召见，神气高朗，轩轩然若霞举。上不觉亡万乘之尊，因命纳屦，白遂展足与高力士曰：「去靴。」力士失势，遽为脱之。及出，上指白谓力士曰：「此人……
25,卷十二·语资,三校,V25-P424,人物政事、建筑寺塔、饮食医药、梦兆占卜、超自然力量,将相臣子、宫殿城楼、医术药理、占卜预言、灵异物件,薛平司徒常送太仆卿周皓，上诸色人吏中来有老人，八十余，著绯。皓独问：「君属此司多少时？」老人言：「某本艺正伤折，天宝初，高将军郎君被人打，下颔骨脱，某为正之。高……
25,卷十二·语资,三校,V25-P425,人物政事、动物、植物、建筑寺塔、佛道宗教,僧尼、隐逸高人、兽类、树木、宫殿城楼、佛法、道法,大历末，禅师玄览住荆州陟屺寺，道高有风韵，人不可得而亲。张璪常画古松于斋壁，符载赞之，卫象诗之，亦时三绝，览悉加垩焉。人问其故，曰：「无事疥吾壁也。」僧那即其甥……
25,卷十二·语资,三校,V25-P426,动物、饮食医药、超自然力量,兽类、医术药理、灵异物件,马仆射既立勋业，颇自矜伐，常有陶侃之意，故呼田悦为钱龙，至今为义士非之。当时有揣其意者，乃先著谣于军中，曰：「斋钟动也，和尚不上堂。」月余，方异其服色，谒之，言……
26,卷十三·冥迹,三校,V26-P431,人物政事、植物、建筑寺塔、器物技艺、佛道宗教、丧葬冥界、梦兆占卜、天文地理,帝王、果蔬、宫殿城楼、衣饰、佛法、丧葬、占卜预言、天象、地理山水,长白山西有夫人墓，魏孝昭之世，搜扬天下才俊，清河崔罗什，弱冠有令望，被徵诣州，夜经于此。忽见朱门粉壁，楼台相望。俄有青衣出，语什曰：「女郎须见崔郎。」什怳然下马……
26,卷十三·冥迹,三校,V26-P433,植物、饮食医药,花草、食物饮品,于襄阳頔在镇时，选人刘某入京，逢一举人，年二十许，言语明晤，同行数里，意甚相得。因藉草，刘有酒，倾数杯。日暮，举人指支迳曰：「某弊止从此数里，能左顾乎？」刘辞以……
26,卷十三·冥迹,三校,V26-P434,动物、佛道宗教、天文地理、超自然力量,兽类、佛法、天象、灵异物件,顾况丧子，年十七。其子魂游，恍惚如梦，不离其家。顾悲伤不已，因作诗，吟之且哭。诗云：「老人丧其子，日暮泣成血。老人年七十，不作多时别。」其子听之感恸，因自誓：「……
27,续·尸穸,三校,X27-P442,鬼怪妖魅、饮食医药,鬼、医术药理,世人死者有作伎乐，名为乐丧。魌头，所以存亡者之魂气也。名苏衣被，苏苏如也。曰狂阻，一曰触圹。四目曰方相，两目曰。据费长房识李娥药丸，谓之方相脑，则方相或鬼物也，……
27,续·尸穸,三校,X27-P447,器物技艺、丧葬冥界,武器、丧葬,「吊」字，矢贯弓也。古者葬弃中野，《礼》：贯弓而吊，以助鸟兽之害。后魏俗竟厚葬，棺厚高大，多用柏木，两边作大铜鐶钮，不问公私贵贱，悉白油络幰帏［四庫本為「」］车……
27,续·尸穸,三校,X27-P454,植物、丧葬冥界、梦兆占卜,树木、丧葬、祥瑞灾异,元魏时，菩提寺增多发冢取砖，得人，自言姓崔名涵，字子洪，在地下十二年，如醉人，时复游行，不甚辨了。畏日及水火兵刃。常走，疲极则止。洛阳奉洛里多卖送死之具，涵言：……
27,续·尸穸,三校,X27-P458,器物技艺、丧葬冥界、天文地理,武器、丧葬、天象,"刘晏判官李邈，庄在高陵，庄客悬欠租课，积五六年。邈因官罢归庄，方欲勘责，见仓库盈羡，输尚未毕。邈怪问，悉曰：""某作端公庄客二三年矣，久为盗。近开古冢，冢西去庄十……"
27,续·尸穸,三校,X27-P459,器物技艺、梦兆占卜,武器、祥瑞灾异,《水经》言，越王勾践都琅琊，欲移允常冢，冢中风生，飞沙射人，人不得近，遂止。按《汉旧仪》，将作营陵地，内方石，外沙演，户交横莫耶，设伏弩、伏火、弓矢与沙，盖古制……
27,续·尸穸,三校,X27-P460,丧葬冥界、梦兆占卜,丧葬、祥瑞灾异,又侯白《旌异记》曰：「盗发白茅冢，棺内大吼如雷，野雉悉雊。穿内火起，飞焰赫然，盗被烧死。」得非伏火乎？
27,续·尸穸,三校,X27-P461,器物技艺、天文地理,衣饰、天象,永泰初，有王生者，住在扬州孝感寺北。夏月被酒，手垂于床。其妻恐风射，将举之。忽有巨手出于床前，牵王臂坠床，身渐入地。其妻与奴婢共曳之，不禁地如裂状，初余衣带，顷……
27,续·尸穸,三校,X27-P463,植物、天文地理,树木、天象,处士郑宾于言，尝客河北，有村正妻新死，未殓。日暮，其儿女忽觉有乐声渐近，至庭宇，尸已动矣。及入房，如在梁栋间，尸遂起舞。乐声复出，尸倒，旋出门，随乐声而去。其家……
27,续·尸穸,三校,X27-P464,人物政事、佛道宗教,僧尼、佛法,医僧行儒说，福州有弘济上人，斋戒清苦，常于沙岸得一颅骨，遂贮衣篮中归寺。数日，忽眠中有物啮其耳，以手拨之落，声如数升物，疑其颅骨所为也。及明，果坠在床下，遂破为……
28,卷十四·诺皋记上,三校,V28-P466,人物政事、鬼怪妖魅、天文地理、超自然力量,道士方士、鬼、魂魄、天象、法术仙术,夫度朔司刑，可以知其情状；葆登掌祀，将以著于感通。有生尽幻，游魂为变。乃圣人定璇玑之式，立巫祝之官，考乎十辉之祥，正乎九黎之乱。当有道之日，鬼不伤人；在观德之时……
28,卷十四·诺皋记上,三校,V28-P471,建筑寺塔、饮食医药,宫殿城楼、医术药理,天翁姓张名坚，字刺渴，渔阳人。少不羁，无所拘忌。常张罗得一白雀，爱而养之。梦天刘翁责怒，每欲杀之，白雀辄以报坚，坚设诸方待之，终莫能害。天翁遂下观之，坚盛设宾主……
28,卷十四·诺皋记上,三校,V28-P475,人物政事、鬼怪妖魅、建筑寺塔、天文地理,帝王、将相臣子、仙神、宫殿城楼、天象,灶神名隗，状如美女。又姓张名单，字子郭。夫人字卿忌，有六女，皆名察洽。常以月晦日上天白人罪状，大者夺纪，纪三百日，小者夺算，算百日。故为天帝督使，下为地精。己丑……
28,卷十四·诺皋记上,三校,V28-P476,人物政事、鬼怪妖魅、天文地理,帝王、仙神、天象、地理山水,河伯，人面，乘两龙。又曰人面鱼身。《金匮》言名冯循。《河图》言姓吕名夷，《穆天子传》言无夷，《淮南子》言冯迟。《圣贤记》言：「服八石，得水仙。」《抱朴子》曰：「……
28,卷十四·诺皋记上,三校,V28-P477,梦兆占卜、天文地理,祥瑞灾异、地理山水,甲子神名弓隆，欲入水内，呼之，河伯九千导引，入水不溺。甲戍神名执明，呼之，入火不烧。
28,卷十四·诺皋记上,三校,V28-P479,动物、器物技艺、超自然力量,兽类、衣饰、灵异物件,古龟兹国王阿主儿者，有神异，力能降伏毒龙。时有贾人买市人金银宝货，至夜中，钱并化为炭。境内数百家皆失金宝。王有男先出家，成阿罗汉果。王问之，罗汉曰：「此龙所为。……
28,卷十四·诺皋记上,三校,V28-P480,人物政事、动物,将相臣子、兽类,乾陀国昔有王神勇多谋，号伽当，讨袭诸国，所向悉降。至五天竺国，得上细［四庫本為」］二条，自留，与妃。妃因衣其谒王，当妃乳上有郁金香手印迹，王见惊恐，谓妃曰：「尔……
28,卷十四·诺皋记上,三校,V28-P482,鬼怪妖魅、梦兆占卜、天文地理,仙神、祥瑞灾异、地理山水,太原郡东有崖山，天旱，土人常烧此山以求雨。俗传崖山神娶河伯女，故河伯见火，必降雨救之。今山上多生水草。
28,卷十四·诺皋记上,三校,V28-P488,人物政事、建筑寺塔、器物技艺、天文地理,帝王、宫殿城楼、衣饰、地理山水,平原县西十里，旧有杜林。南燕太上末，有邵敬伯者，家于长白山。有人寄敬伯函书，言：「我吴江使也，令吾通问于济伯。今须过长白，幸君为通之。」仍教敬伯，但于杜林中取树……
28,卷十四·诺皋记上,三校,V28-P489,梦兆占卜、天文地理,梦兆、天象、地理山水,妒妇津，相传言，晋大始中，刘伯玉妻段氏，字光明，性妒忌。伯玉常于妻前诵《洛神赋》，语其妻曰：「娶妇得如此，吾无憾焉。」明光曰：「君何以水神善而欲轻我？吾死，何愁……
28,卷十四·诺皋记上,三校,V28-P492,人物政事、建筑寺塔、器物技艺、佛道宗教、天文地理、超自然力量,将相臣子、宫殿城楼、衣饰、佛法、天象、灵异物件,大定初，有士人随新罗使，风吹至处，人皆长须，语与唐言通，号长须国。人物茂盛，栋宇衣冠，稍异中国，地曰扶桑洲。其署官品，有正长、戢波、目役，岛逻等号。士人历谒数处……
28,卷十四·诺皋记上,三校,V28-P493,人物政事、佛道宗教、梦兆占卜、天文地理、超自然力量,帝王、将相臣子、佛法、祥瑞灾异、天象、地理山水、灵异物件,天宝初，安思顺进五色玉带，又于左藏库中得五色玉杯。上怪近日西尽无五色玉，令责安西诸蕃。蕃言：「比常进皆为小勃律所劫，不达。」上怒，欲征之。群臣多谏，独李右座赞成……
28,卷十四·诺皋记上,三校,V28-P495,植物、器物技艺、饮食医药、天文地理,果蔬、用具杂器、食物饮品、医术药理、天象,大历中，有士人庄在渭南，遇疾卒于京，妻柳氏因庄居。子年十二，夏夜，其子忽恐悸不眠。三更后，忽见老人，白衣，两牙出吻外，熟视之。良久，渐近床前。床前有婢眠熟，因扼……
28,卷十四·诺皋记上,三校,V28-P498,动物、建筑寺塔、佛道宗教、饮食医药、梦兆占卜、天文地理,兽类、寺观塔庙、佛法、食物饮品、祥瑞灾异、天象,博士丘濡说，汝州旁县，五十年前，村人失其女。数岁忽自归，言初被物寐中牵去，倏止处，及明，乃在古塔中。见美丈夫，谓曰：「我天人，分合得汝为妻。自有年限，勿生疑惧。……
28,卷十四·诺皋记上,三校,V28-P501,人物政事、植物、建筑寺塔、佛道宗教、天文地理,帝王、僧尼、花草、宫殿城楼、寺观塔庙、佛法、道法、天象,郑相在梁州，有龙兴寺僧智圆，善总持敕勒之术，制邪理痛多著效，日有数十人候门。智圆腊高稍倦，郑公颇敬之。因求住城东隙地，郑公为起草屋种植，有沙弥、行者各人。居之数……
28,卷十四·诺皋记上,三校,V28-P503,器物技艺、天文地理,武器、用具杂器、地理山水,元和中，苏湛游蓬鹊山，裹粮钻火，境无遗跬。忽谓妻曰：「我行山中，睹倒崖有光镜，必灵境也。明日将投之，今与卿诀。」妻子号泣，止之不得。及明遂行，妻子领奴婢潜随之。……
29,卷十五·诺皋记下,三校,V29-P504,动物、建筑寺塔、饮食医药,鱼类、宫殿城楼、食物饮品、医术药理,和州刘录事者，大历中，罢官居和州旁县。食兼数人，尤能食鲙，常言鲙味未尝果腹。邑客乃网鱼百余斤，会于野亭，观其下箸。初食鲙数叠，忽似哽，咯出骨珠子，大如黑豆，乃置……
29,卷十五·诺皋记下,三校,V29-P507,人物政事、器物技艺、梦兆占卜、天文地理,将相臣子、用具杂器、衣饰、祥瑞灾异、天象、地理山水,僧无可言，近传有白将军者，常于曲江洗马，马忽跳出惊走。前足有物，色白如衣带，萦绕数匹。遽令解之，血流数升。白异之，遂封纸帖中，藏衣箱内。日，送客至滻水，出示诸客……
29,卷十五·诺皋记下,三校,V29-P508,佛道宗教、天文地理,佛法、地理山水,景公寺前街中，旧有巨井，俗呼为八角井。元和初，有公主夏中过，见百姓方汲，令从婢以银棱碗就井取水，误坠碗。经月余，出于渭河。
29,卷十五·诺皋记下,三校,V29-P509,器物技艺、饮食医药、梦兆占卜、天文地理,用具杂器、衣饰、食物饮品、占卜预言、天象,东平未用兵，有举人孟不疑，客昭义。夜至驿，方欲濯足，有称淄青张评事者，仆从数十，孟欲参谒，张被酒，初不顾，孟因退就西间。张连呼驿吏索煎饼，孟默然窥之，且怒其傲。……
29,卷十五·诺皋记下,三校,V29-P510,人物政事、建筑寺塔、器物技艺、佛道宗教、饮食医药、梦兆占卜、天文地理,僧尼、宫殿城楼、用具杂器、衣饰、佛法、道法、医术药理、占卜预言、天象、地理山水,"刘积中，常于京近县庄居。妻病重。于夕刘未眠，忽有妇人白首，长才三尺，自灯影中出，谓刘曰：「夫人病，唯我能理，何不祈我。""刘素刚，咄之，姥徐戟手曰：「勿悔！勿悔！……"
29,卷十五·诺皋记下,三校,V29-P511,建筑寺塔、梦兆占卜,宫殿城楼、祥瑞灾异,临川郡南城县令戴察，初买宅于馆娃坊。暇日，与弟闲坐厅中，忽听妇人聚笑声，或近或远，察颇异之。笑声渐近，忽见妇人数十，散在厅前，倏忽不见。如是累日，察不知所为。厅……
29,卷十五·诺皋记下,三校,V29-P517,动物、器物技艺、天文地理,鸟类、用具杂器、地理山水,伍相奴，或扰人，许于伍相庙多已。旧说姓姚，二姓王，三姓汪。昔值洪水，食都树皮，饿死，化为鸟都，皮骨为猪都，妇女为人都。鸟都左腋下有镜印，阔二寸分，右脚无大指，右……
29,卷十五·诺皋记下,三校,V29-P519,动物、建筑寺塔、器物技艺、佛道宗教、天文地理、超自然力量,兽类、宫殿城楼、用具杂器、道法、天象、法术仙术,刘元鼎为蔡州蔡州新破，食场狐暴，刘遣吏生捕，日于球场纵犬逐之为乐。经年，所杀百数。后获一疥狐，纵五六犬皆不敢逐，狐亦不走。刘大异之，令访大将家猎狗及监军亦自夸巨……
29,卷十五·诺皋记下,三校,V29-P520,饮食医药、天文地理,医术药理、天象,南中有兽名风狸，如狙，眉长好羞，见人辄低头。其溺能理风疾。卫士多言风狸杖难得于翳形草。南人以上长绳系于野外大树下，入匿于旁树穴中伺之。三日后，知无人至，乃于草中……
29,卷十五·诺皋记下,三校,V29-P521,人物政事、建筑寺塔、梦兆占卜、天文地理、超自然力量,将相臣子、宫殿城楼、祥瑞灾异、地理山水、灵异物件,开成末，永兴坊百姓王乙掘井，过常井一丈余无水。忽听向下有人语及鸡声，甚喧闹，近如隔壁。井匠惧，不敢掘。街司申金吾韦处仁将军，韦以事涉怪异，不复奏，遽令塞之。据亡……
29,卷十五·诺皋记下,三校,V29-P523,动物、建筑寺塔、器物技艺,昆虫、宫殿城楼、用具杂器,太和末，荆南松滋县南，有士人寄居亲故庄中肄业。初至之夕，二更后，方张灯临案，忽有小人才半寸，葛巾杖策，入门谓士人曰：「乍到无主人，当寂寞。」其声大如苍蝇。士人素……
29,卷十五·诺皋记下,三校,V29-P524,建筑寺塔、超自然力量,宫殿城楼、灵异物件,京宣平坊，有官人夜归入曲，有卖油者张帽驱驴，驮桶不避，导者搏之，头随而落，遂遽入一大宅门。官人异之，随入，至大槐树下遂灭。因告其家，即掘之。深数尺，其树根枯，下……
