volume_index,volume_title,source,paragraph_id,duplicate_broad_categories,duplicate_specific_subjects,text
29,卷十五·诺皋记下,三校,V29-P527,饮食医药、梦兆占卜,食物饮品、祥瑞灾异,郓州阚司仓者，家在荆州。其女乳母钮氏，有子，妻爱之，与其子均焉，衣物饮食悉等。忽日，妻偶得林檎蒂，戏与己子，孔母乃怒曰：「小娘子成长，忘我矣。常有物与我子停分，……
29,卷十五·诺皋记下,三校,V29-P528,饮食医药、天文地理,医术药理、天象,荆州处士侯又玄，常出郊，厕于荒冢上。及下，跌伤其肘，创甚。行数百步，逢老人，问何所苦也，又玄见其肘。老人言：「偶有良药，可封之，下日不开必愈。」又玄如其言。及解……
29,卷十五·诺皋记下,三校,V29-P529,饮食医药、天文地理,食物饮品、医术药理、地理山水,许卑山人言，江左数十年前，有商人左膊上有疮，如人面，亦无它苦。商人戏滴酒口中，其面亦赤。以物食之，凡物必食，食多觉膊内肉涨起，疑胃在其中也。或不食之，则一臂痺焉……
29,卷十五·诺皋记下,三校,V29-P530,器物技艺、天文地理,武器、地理山水,工部员外张周封言，今年春，拜扫假回，至湖城逆旅。说去年秋有河北军将过此，至郊外数里，忽有旋风如升器，常起于马前，军将以鞭击之转大，遂旋马首，鬣起如植。军将惧，下……
30,卷十六·广动植之一,三校,V30-P532,动物、植物、器物技艺、饮食医药、天文地理,龙蛇类、鸟类、兽类、鱼类、昆虫、花草、果蔬、用具杂器、食物饮品、天象、地理山水,羽嘉生飞龙，飞龙生凤，凤生鸾，鸾生庶鸟。应龙生建鸟，建鸟生麒麟，骐麟生庶兽。分鳞生蛟龙，蛟龙生鲲鲠，鲲鲠生建邪，建邪生庶鱼。分潭生先龙，先龙生玄亢，玄亢生灵……
30,卷十六·广动植之一,三校,V30-P533,人物政事、动物、植物、天文地理,侠盗刺客、鸟类、兽类、鱼类、花草、果蔬、药草、天象,人参处处生，兰长生为瑞。有实曰果。又在木曰果。小麦忌戌，大麦忌子。荠、葶苈、菥莫为三叶，孟夏煞之。乌头壳外有毛，石劫应节生花。木再花，夏有雹。李再花，秋大霜。木……
30,卷十六·广动植之一,三校,V30-P534,人物政事、动物,将相臣子、兽类、鱼类,葛稚川尝就上林令鱼泉，得朝臣所上草木名二十馀种。邻人石琼，就之求借，皆遗弃。语曰：「买鱼得与，不如食茹。」「宁去累世宅，不去{制鱼}鱼额。」「洛鲤伊鲂，贵于牛……
31,卷十六·广动植之一,三校,V31-P537,动物、天文地理,鸟类、天象、地理山水,鹳，江淮谓群鹳旋飞为鹳井。鹤亦好旋飞，必有风雨。人探巢取鹳子，六十里早。能群飞薄霄激雨，雨为之散。
31,卷十六·广动植之一,三校,V31-P538,动物、梦兆占卜,鸟类、占卜预言,乌鸣地上无好声。人临行，乌鸣而前引，多喜，此旧占所不载。贞元四年，郑、汴二州，群鸟飞入田李纳绪境内，衔木为城，高至二三尺，方十馀里。纳绪恶而命焚之，信宿如旧，乌……
31,卷十六·广动植之一,三校,V31-P541,动物、天文地理,兽类、地理山水,燕，凡狐白貉鼠之类，燕见之则毛脱。或言燕蛰于水底。旧说燕不入室，是井之虚也。取桐为男女各一，投井中，燕必来。胸班黑，声大，名胡燕。其巢有容匹素练者。
31,卷十六·广动植之一,三校,V31-P544,人物政事、动物,帝王、鸟类,鹦鹉，能飞。众鸟趾前三后一，唯鹦鹉四趾齐分。凡鸟下睑眨上，独此鸟两睑俱动，如人目。玄宗时，有五色鹦鹉能言，上令左右试牵帝衣，鸟辄瞋目叱吒。岐府文学能延京献《鹦鹉……
31,卷十六·广动植之一,三校,V31-P551,动物、梦兆占卜、超自然力量,鸟类、昆虫、祥瑞灾异、灵异物件,异鸟，天宝二年，平卢有紫虫食禾苗。时东北有赤头鸟，群飞食之。开元二十三年，榆关有予方虫，延入平州界，亦有群雀食之。又开元中，具州蝗虫食禾，有大白鸟数千，小白……
31,卷十六·广动植之一,三校,V31-P554,动物、佛道宗教,鸟类、道法,吐绶鸟，鱼复县南山有鸟，大如鸲鹆，羽色多黑，杂以黄白，头颊似雉，有时吐物，长数寸，丹彩彪炳，形色类绶，因名为吐绶鸟。又食必蓄膆，臆前大如斗，虑触其膆，行每远草木……
31,卷十六·广动植之一,三校,V31-P566,人物政事、动物,帝王、鸟类,嗽金鸟，出昆明国。形如雀，色黄，常翱翔于海上。魏明帝时，其国来献此鸟。饴以真珠及龟脑，常吐金屑如粟，铸之乃为器服。宫人争以鸟所吐金为钗珥，谓之辟寒金，以鸟不畏寒……
32,卷十六·广动植之一,三校,V32-P577,动物、饮食医药、天文地理,兽类、食物饮品、医术药理、天象、地理山水,又言，龙象六十岁，骨方足。今荆地象色黑，两牙，江猪也。咸亨二年，周澄国遣使上表，言：「诃伽国有白象，首垂四牙，身运五足，象之所在，其土必丰。以水洗牙，饮之愈疾。……
32,卷十六·广动植之一,三校,V32-P578,鬼怪妖魅、饮食医药、天文地理,仙神、医术药理、天象,虎交而月晕。仙人郑思远常骑虎，故人许隐齿痛求治，郑曰：「唯得虎须，及热插齿间即愈。」郑为拔数茎与之，因知虎须治齿也。虎杀人，能令尸起自解衣，方食之。虎威如乙字，……
32,卷十六·广动植之一,三校,V32-P579,动物、植物、饮食医药,兽类、花草、药草、食物饮品、医术药理,马，虏中护兰马，玉白马也，亦曰玉面谙真马，十三岁马也。以十三岁已下，可以留种。旧种马，戎马八尺，田马七尺，怒马六尺。瓜州饲马以草，沙州以茨萁，凉州以勃突浑，蜀……
32,卷十六·广动植之一,三校,V32-P582,人物政事、天文地理,帝王、地理山水,北虏之先索国有泥师都，二妻生四子。子化为鸿，遂委三子，谓曰：「尔可从古旃。」古旃，牛也。三子因随牛，牛所粪，悉成肉酪。太原县北有银牛山，汉建武二十年，有人骑白牛……
32,卷十六·广动植之一,三校,V32-P585,动物、器物技艺、饮食医药、天文地理,兽类、乐器、医术药理、地理山水,犀之通天者必恶影，常饮浊水。当其溺时，人趁不复移足。角之理，形似百物。或云犀角通者是其病，然其理有倒插、正插、腰鼓插。倒者，半已下通。正者，半已上通。腰鼓者，中……
32,卷十六·广动植之一,三校,V32-P598,动物、天文地理、异域物产,兽类、地理山水、异国,大尾羊，康居出大尾羊，尾上旁广，重十斤。又僧玄奘至西域，大雪山高岭下有一村养羊，大如驴。宾国出野青羊，尾如翠色，土人食之。
32,卷十六·广动植之一,三校,V32-P599,动物、植物、器物技艺、饮食医药、天文地理,龙蛇类、鸟类、兽类、鱼类、昆虫、花草、果蔬、用具杂器、食物饮品、天象、地理山水,羽嘉生飞龙，飞龙生凤，凤生鸾，鸾生庶鸟。应龙生建鸟，建鸟生麒麟，骐麟生庶兽。分鳞生蛟龙，蛟龙生鲲鲠，鲲鲠生建邪，建邪生庶鱼。分潭生先龙，先龙生玄魧，玄魧生灵龟，……
32,卷十六·广动植之一,三校,V32-P600,人物政事、动物、植物、天文地理,侠盗刺客、鸟类、兽类、鱼类、花草、果蔬、药草、天象,人参处处生，兰长生为瑞。有实曰果。又在木曰果。小麦忌戌，大麦忌子。荠、葶苈、菥莫为三叶，孟夏煞之。乌头壳外有毛，石劫应节生花。木再花，夏有雹。李再花，秋大霜。木……
32,卷十六·广动植之一,三校,V32-P601,人物政事、动物,将相臣子、兽类、鱼类,"葛稚川尝就上林令鱼泉，得朝臣所上草木名二十余种。邻人石琼，就之求借，皆遗弃。语曰：""买鱼得鱮，不如食茹。""""宁去累世宅，不去｛制魚｝鱼额。""""洛鲤伊鲂，贵于牛羊……"
32,卷十六·广动植之一,三校,V32-P604,动物、天文地理,鸟类、天象、地理山水,鹳，江淮谓群鹳旋飞为鹳井。鹤亦好旋飞，必有风雨。人探巢取鹳子，六十里早。能群飞薄霄激雨，雨为之散。
32,卷十六·广动植之一,三校,V32-P605,动物、梦兆占卜,鸟类、占卜预言,乌鸣地上无好声。人临行，乌鸣而前引，多喜，此旧占所不载。贞元四年，郑、汴二州，群鸟飞入田李纳绪境内，衔木为城，高至二三尺，方十余里。纳绪恶而命焚之，信宿如旧，乌……
32,卷十六·广动植之一,三校,V32-P608,动物、天文地理,兽类、地理山水,燕，凡狐白貉鼠之类，燕见之则毛脱。或言燕蛰于水底。旧说燕不入室，是井之虚也。取桐为男女各一，投井中，燕必来。胸班黑，声大，名胡燕。其巢有容匹素练者。
32,卷十六·广动植之一,三校,V32-P611,人物政事、动物,帝王、鸟类,鹦鹉，能飞。众鸟趾前三后一，唯鹦鹉四趾齐分。凡鸟下睑眨上，独此鸟两睑俱动，如人目。玄宗时，有五色鹦鹉能言，上令左右试牵帝衣，鸟辄瞋目叱吒。岐府文学能延京献《鹦鹉……
32,卷十六·广动植之一,三校,V32-P618,动物、梦兆占卜、超自然力量,鸟类、昆虫、祥瑞灾异、灵异物件,"异鸟，天宝二年，平卢有紫虫食禾苗。时东北有赤头鸟，群飞食之。开元二十三年，榆关有［四庫本為""虸""］蚄虫，延入平州界，亦有群雀食之。又开元中，具州蝗虫食禾，有大白……"
32,卷十六·广动植之一,三校,V32-P621,动物、佛道宗教,鸟类、道法,吐绶鸟，鱼复县南山有鸟，大如鸲鹆，羽色多黑，杂以黄白，头颊似雉，有时吐物，长数寸，丹彩彪炳，形色类绶，因名为吐绶鸟。又食必蓄嗉，臆前大如斗，虑触其嗉，行每远草木……
32,卷十六·广动植之一,三校,V32-P633,人物政事、动物,帝王、鸟类,嗽金鸟，出昆明国。形如雀，色黄，常翱翔于海上。魏明帝时，其国来献此鸟。饴以真珠及龟脑，常吐金屑如粟，铸之乃为器服。宫人争以鸟所吐金为钗珥，谓之辟寒金，以鸟不畏寒……
32,卷十六·广动植之一,三校,V32-P644,动物、饮食医药、天文地理,兽类、食物饮品、医术药理、天象、地理山水,又言，龙象六十岁，骨方足。今荆地象色黑，两牙，江猪也。咸亨二年，周澄国遣使上表，言：「诃伽国有白象，首垂四牙，身运五足，象之所在，其土必丰。以水洗牙，饮之愈疾。……
32,卷十六·广动植之一,三校,V32-P645,鬼怪妖魅、饮食医药、天文地理,仙神、医术药理、天象,"虎交而月晕。仙人郑思远常骑虎，故人许隐齿痛求治，郑曰：""唯得虎须，及热插齿间即愈。""郑为拔数茎与之，因知虎须治齿也。虎杀人，能令尸起自解衣，方食之。虎威如乙字，……"
32,卷十六·广动植之一,三校,V32-P646,动物、植物、饮食医药,兽类、花草、药草、食物饮品、医术药理,马，虏中护兰马，玉白马也，亦曰玉面谙真马，十三岁马也。以十三岁已下，可以留种。旧种马，戎马八尺，田马七尺，怒马六尺。瓜州饲马以薲草，沙州以茨萁，凉州以勃突浑，蜀……
32,卷十六·广动植之一,三校,V32-P649,人物政事、天文地理,帝王、地理山水,北虏之先索国有泥师都，二妻生四子。子化为鸿，遂委三子，谓曰：「尔可从古旃。」古旃，牛也。三子因随牛，牛所粪，悉成肉酪。太原县北有银牛山，汉建武二十年，有人骑白牛……
32,卷十六·广动植之一,三校,V32-P652,动物、器物技艺、饮食医药、天文地理,兽类、乐器、医术药理、地理山水,犀之通天者必恶影，常饮浊水。当其溺时，人趁不复移足。角之理，形似百物。或云犀角通者是其病，然其理有倒插、正插、腰鼓插。倒者，半已下通。正者，半已上通。腰鼓者，中……
32,卷十六·广动植之一,三校,V32-P665,动物、天文地理、异域物产,兽类、地理山水、异国,大尾羊，康居出大尾羊，尾上旁广，重十斤。又僧玄奘至西域，大雪山高岭下有一村养羊，大如驴。罽宾国出野青羊，尾如翠色，土人食之。
33,卷十七·广动植之二,三校,V33-P667,佛道宗教、天文地理,佛法、地理山水,井鱼，井鱼脑有穴，每翕水辄于脑穴蹙出，如飞泉散落海中，舟人竟以空器贮之。海水咸苦，经鱼脑穴出反淡，如泉水焉。成式见焚僧菩提胜说。
33,卷十七·广动植之二,三校,V33-P668,动物、器物技艺,鱼类、武器,异鱼，东海渔人言，近获鱼，长五六尺，肠胃成胡鹿刀槊之状，或号秦皇鱼。
33,卷十七·广动植之二,三校,V33-P671,动物、天文地理,鱼类、地理山水,乌贼，旧说名河伯度事小吏，遇大鱼辄放墨，方数尺，以混其身。江东人或取墨书契，以脱人财物，书迹如淡墨，逾年字消，唯空纸耳。海人言，昔秦皇东游，弃算袋于海，化为此鱼……
33,卷十七·广动植之二,三校,V33-P675,动物、器物技艺,鱼类、用具杂器,印鱼，长一尺三寸，额上四方如印，有字。诸大鱼应死者，先以印封之。
33,卷十七·广动植之二,三校,V33-P677,动物、饮食医药、梦兆占卜、天文地理,鱼类、食物饮品、祥瑞灾异、地理山水,鲵鱼，如鲇，四足长尾，能上树。天旱辄含水上山，以草叶覆身，张口，鸟来饮水，因吸食之，声如小儿。峡中人食之，先缚于树鞭之，身上白汗出如构汁，此方可食，不尔有毒。
33,卷十七·广动植之二,三校,V33-P680,建筑寺塔、天文地理,宫殿城楼、地理山水,温泉中鱼，南人随溪有三亭城，城下温泉中生小鱼。
33,卷十七·广动植之二,三校,V33-P687,动物、天文地理,兽类、地理山水,平原郡贡糖蟹，采于河间界。每年生贡，斩冰火照，悬老犬肉，蟹觉老犬肉即浮，因取之。一枚直百金。以毡蜜束于驿马，驰至于京。
34,卷十七·广动植之二,三校,V34-P700,人物政事、动物、建筑寺塔、梦兆占卜、天文地理,隐逸高人、昆虫、宫殿城楼、占卜预言、地理山水,蚁，秦中多巨黑蚁，好斗，俗呼为马蚁。次有色窃赤者。细蚁中有黑者，迟钝，力举等身铁。有窃黄者，最有兼弱之智。成式儿戏时，尝以棘刺标蝇，置其来路，此蚁触之而返，或去……
34,卷十七·广动植之二,三校,V34-P710,人物政事、饮食医药,帝王、医术药理,冷蛇，申王有肉疾，腹垂至，每出则以百练束之，至暑月，常息不可过。玄宗诏南方取冷蛇二条赐之，蛇长数尺，色白，不螫人，执之冷如握冰。申王腹有数约，夏月置于约中，……
34,卷十七·广动植之二,三校,V34-P712,建筑寺塔、天文地理,宫殿城楼、天象,白蜂窠，成式修竹里私第，果园数亩。壬戌年，有蜂如麻子蜂，胶土为窠于庭前檐，大如鸡卵，色正白可爱。家弟恶而坏之，其冬果衅钟手足。《南史》言，宋明帝恶言白门。《金楼……
34,卷十七·广动植之二,三校,V34-P730,人物政事、饮食医药、天文地理,道士方士、医术药理、地理山水,虱，旧说虱虫饮赤龙所浴水则愈。虱恶水银。人有病虱者，虽香衣沐浴不得已。道士崔白言，荆州秀才张告，尝扪得两头虱。有草生山足湿处，叶如百合，对叶独茎，茎微赤，高一二……
34,卷十七·广动植之二,三校,V34-P731,动物、异域物产,昆虫、异国,蝗，荆州有帛师，号法通，本安西人。少于东天竺出家，言蝗虫腹下有梵字，或白天下来者，乃忉利天梵天来者。西域验其字作木天坛法禳之。今蝗虫首有「王」字，固自不可晓。或……
34,卷十七·广动植之二,三校,V34-P736,人物政事、动物、建筑寺塔、梦兆占卜、天文地理,隐逸高人、昆虫、宫殿城楼、占卜预言、地理山水,蚁，秦中多巨黑蚁，好斗，俗呼为马蚁。次有色窃赤者。细蚁中有黑者，迟钝，力举等身铁。有窃黄者，最有兼弱之智。成式儿戏时，尝以棘刺标蝇，置其来路，此蚁触之而返，或去……
34,卷十七·广动植之二,三校,V34-P746,人物政事、饮食医药,帝王、医术药理,冷蛇，申王有肉疾，腹垂至骭，每出则以百练束之，至暑月，常骭息不可过。玄宗诏南方取冷蛇二条赐之，蛇长数尺，色白，不螫人，执之冷如握冰。申王腹有数约，夏月置于约中，……
34,卷十七·广动植之二,三校,V34-P748,建筑寺塔、天文地理,宫殿城楼、天象,白蜂窠，成式修竹里私第，果园数亩。壬戌年，有蜂如麻子蜂，胶土为窠于庭前檐，大如鸡卵，色正白可爱。家弟恶而坏之，其冬果衅钟手足。《南史》言，宋明帝恶言白门。《金楼……
34,卷十七·广动植之二,三校,V34-P766,人物政事、饮食医药、天文地理,道士方士、医术药理、地理山水,虱，旧说虱虫饮赤龙所浴水则愈。虱恶水银。人有病虱者，虽香衣沐浴不得已。道士崔白言，荆州秀才张告，尝扪得两头虱。有草生山足湿处，叶如百合，对叶独茎，茎微赤，高一二……
34,卷十七·广动植之二,三校,V34-P767,动物、异域物产,昆虫、异国,"蝗，荆州有帛师，号法通，本安西人。少于东天竺出家，言蝗虫腹下有梵字，或白天下来者，乃忉利天梵天来者。西域验其字作木天坛法禳之。今蝗虫首有""王""字，固自不可晓。或……"
34,卷十七·广动植之二,三校,V34-P769,植物、建筑寺塔,树木、宫殿城楼,松，今言两粒、五粒，粒当言鬣。成式修竹里私第，大堂前有五鬣松两根，大财如碗，甲子年结实，味如新罗、南诏者不别。五鬣松皮不鳞，中使仇士良水磑亭子在城东，有两鬣皮不……
34,卷十七·广动植之二,三校,V34-P777,建筑寺塔、梦兆占卜,宫殿城楼、祥瑞灾异,"异木，大历中，成都百姓郭远，因樵获瑞木一茎，理成字曰""天下太平""，诏藏于秘阁。"
34,卷十七·广动植之二,三校,V34-P781,人物政事、天文地理、超自然力量,帝王、天象、地理山水、灵异物件,甘子，天宝十年，上谓宰臣曰：「近日于宫内种甘子数株，今秋结实一百五十颗，与江南蜀道所进不异。」宰臣贺表曰：「雨露所均，混天区而齐被；草木有性，凭地气而潜通。故得……
34,卷十七·广动植之二,三校,V34-P785,人物政事、植物,帝王、花草、果蔬,汉帝杏，济南郡之东南有分流山，山上多杏，大如梨，黄如橘，土人谓之汉帝杏，亦曰金杏。
34,卷十七·广动植之二,三校,V34-P791,人物政事、植物、佛道宗教、超自然力量,将相臣子、树木、花草、果蔬、佛法、道法、灵异物件,娑罗，巴陵有寺，僧房床下忽生木，随伐随长。外国僧见曰：「此娑罗也。」元嘉初，出花如莲。天宝初，安西道进娑罗枝，状言：「臣所管四镇，有拔汗那最为密近，木有娑罗树，……
34,卷十七·广动植之二,三校,V34-P798,植物、饮食医药,果蔬、食物饮品,蒲萄，俗言蒲萄蔓好引于西南。庾信谓魏使尉瑾曰：「我在邺，遂大得蒲萄，奇有滋味。」陈昭曰：「作何形状？」徐君房曰：「有类软枣。」信曰：「君殊不体物，可得言似生荔枝……
34,卷十七·广动植之二,三校,V34-P799,建筑寺塔、器物技艺,寺观塔庙、用具杂器,贝丘之南有蒲萄谷，谷中蒲萄，可就其所食之，或有取归者即失道，世言王母蒲萄也。天宝中，沙门昙霄因游诸岳，至此谷，得蒲萄食之。又见枯蔓堪为杖，大如指，五尺余，持还本……
34,卷十七·广动植之二,三校,V34-P806,植物、建筑寺塔、器物技艺、佛道宗教、梦兆占卜,花草、寺观塔庙、用具杂器、佛法、道法、祥瑞灾异,菩提树，出摩伽陀国，在摩诃菩提寺，盖释迦如来成道时树，名思惟树。茎干黄白，枝叶青翠，经冬不凋。至佛入灭日，变色凋落，过已还生。至此日，国王人民大作佛事，收叶而归……
34,卷十七·广动植之二,三校,V34-P813,植物、饮食医药,花草、医术药理,无石子，出波斯国，波斯呼为摩贼。树长六七丈，围八九尺，叶似桃叶而长。三月开花，白色，花心微红。子圆如弹丸，初青，熟乃黄白。虫食成孔者正熟，皮无孔者入药用。其树年……
34,卷十七·广动植之二,三校,V34-P814,天文地理、异域物产,天象、异国,紫树，出真腊国，真腊国呼为勒佉。亦出波斯国。树长一丈，枝条郁茂，叶似橘，经冬而凋。三月开花，白色，不结子。天大雾露及雨沾濡，其树枝条即出紫。波斯国使乌海及沙利深……
34,卷十七·广动植之二,三校,V34-P816,植物、异域物产,果蔬、异国,婆那娑树，出波斯国，亦出拂林，呼为阿蔀嚲。树长五六丈，皮色青绿，叶极光净，冬夏不凋。无花结实，其实从树茎出，大如冬瓜，有壳裹之，壳上有刺，瓤至甘甜，可食。核大如……
34,卷十七·广动植之二,三校,V34-P818,植物、异域物产,花草、异国,偏桃，出波斯国，波斯国呼为婆淡。树长五六丈，围四五尺，叶似桃而阔大。三月开花，白色。花落结实，状如桃子而形偏，故谓之偏桃。其肉苦涩，不可啖。核中仁甘甜，西域诸国……
34,卷十七·广动植之二,三校,V34-P819,植物、异域物产,果蔬、异国,槃砮穑树，出波斯国。亦出拂林国，拂林呼为群汉。树长三丈，围四五尺，叶似细榕，经寒不凋。花似橘，白色。子绿，大如酸枣，其味甜腻，可食。西域人压为油以涂身，可去风痒……
34,卷十七·广动植之二,三校,V34-P820,植物、饮食医药、异域物产,花草、果蔬、食物饮品、异国,齐暾树，出波斯国。亦出拂林国，拂林呼为齐虚。树长二三丈，皮青白，花似柚，极芳香。子似杨桃，五月熟。西域人压为油以煮饼果，如中国之用巨胜也。
34,卷十七·广动植之二,三校,V34-P824,植物、饮食医药、异域物产,花草、医术药理、异国,香齐，出波斯国。拂林呼为顸勃梨咃。长丈余，围尺许。皮色青薄而极光净，叶似阿魏，每三叶生于条端，无花实。西域人常八月伐之，至腊月更抽新条，极滋茂。若不剪除，反枯死……
34,卷十七·广动植之二,三校,V34-P825,植物、异域物产,花草、异国,波斯皂荚，出波斯国，呼为忽野檐默。拂林呼为阿梨去伐。树长三四丈，围四五尺，叶似构缘而短小，经寒不凋。不花而实，其荚长二尺，中有隔。隔内各有一子，大如指头，赤色，……
34,卷十七·广动植之二,三校,V34-P829,植物、天文地理、异域物产,花草、地理山水、异国,野悉蜜，出拂林国，亦出波斯国。苗长七八尺，叶似梅叶，四时敷荣。其花五出，白色，不结子。花若开时，遍野皆香，与岭南詹糖相类。西域人常采其花压以为油，甚香滑。
34,卷十七·广动植之二,三校,V34-P830,植物、异域物产,果蔬、异国,阿驿，波斯国呼为阿馹，拂林呼为底珍。树长丈四五，枝叶繁茂。叶有五出，似椑麻。无花而实，实赤色，类椑子，味似甘柿，月熟。
34,卷十七·广动植之二,三校,V34-P832,植物、器物技艺、天文地理,药草、用具杂器、地理山水,大历八年，庐江县紫芝生，高丈五尺。芝类至多：参成芝，断而可续。夜光芝，株九实。实坠地如七寸镜，视如牛目，茅君种于句曲山。隐辰芝，状如斗，以屋为节，以茎为刚。
34,卷十七·广动植之二,三校,V34-P833,动物、建筑寺塔、佛道宗教、天文地理,鸟类、宫殿城楼、道法、地理山水,《仙经》言，穿地六尺，以鐶实一枚种之，灌以黄水五合，以土坚筑之。三年生苗如匏。实如桃，五色，名凤脑芝。食其实，唾地为凤，乘升太极。白符芝，大雪而华。五德芝，如车……
34,卷十七·广动植之二,三校,V34-P835,人物政事、建筑寺塔、佛道宗教、丧葬冥界,僧尼、寺观塔庙、佛法、丧葬,苔，慈恩寺唐三藏院后檐阶，开成末有苔，状如苦苣。初于砖上，色如盐绿，轻嫩可爱。谈论僧义林，太和初改葬棋法师，初开冢，香气袭人，侧卧砖台上，形如生。砖上苔厚二寸余……
34,卷十七·广动植之二,三校,V34-P836,植物、建筑寺塔、天文地理,树木、宫殿城楼、天象,瓦松，崔融《瓦松赋序》曰：「崇文馆瓦松者，产于屋溜之下。谓之木也，访山客而未详。谓之草也，验农皇而罕记。」赋云：「煌煌特秀，状金芝之产溜；历历虚悬，若星榆之种天……
